{
  "id": "gen.calc.add.11.7.v708",
  "title": "calc add (11,7)",
  "prompt": "Implement `calc(a, b)` in `calc.py` for integer add. Make tests pass.",
  "capability": [
    "write",
    "edit"
  ],
  "difficulty": 1,
  "language": "python",
  "tags": [
    "generated",
    "calc",
    "add",
    "full"
  ],
  "timeout_s": 120,
  "setup": {
    "files": {
      "calc.py": "def calc(a, b):\n    return a + b\n",
      "test_calc.py": "from calc import calc\n\n\ndef test_op():\n    assert calc(11, 7) == 18\n"
    }
  },
  "checks": [
    {
      "function": "compile_ok",
      "args": {
        "path": "calc.py"
      }
    },
    {
      "function": "pytest_passes",
      "args": {
        "path": "test_calc.py"
      }
    },
    {
      "function": "no_stub_content",
      "args": {}
    }
  ]
}