{
  "id": "gen.calc.div.20.4.v219",
  "title": "calc div (20,4)",
  "prompt": "Implement `calc(a, b)` in `calc.py` for integer div. Make tests pass.",
  "capability": [
    "write",
    "edit"
  ],
  "difficulty": 1,
  "language": "python",
  "tags": [
    "generated",
    "calc",
    "div",
    "full"
  ],
  "timeout_s": 120,
  "setup": {
    "files": {
      "calc.py": "def calc(a, b):\n    if b == 0:\n        raise ValueError('div by zero')\n    return a // b\n",
      "test_calc.py": "from calc import calc\n\n\ndef test_op():\n    assert calc(20, 4) == 5\n"
    }
  },
  "checks": [
    {
      "function": "compile_ok",
      "args": {
        "path": "calc.py"
      }
    },
    {
      "function": "pytest_passes",
      "args": {
        "path": "test_calc.py"
      }
    },
    {
      "function": "no_stub_content",
      "args": {}
    }
  ]
}