{
  "id": "gen.multi.pkg_gamma_62.v362",
  "title": "package pkg_gamma_62",
  "prompt": "Create package `pkg_gamma_62` with `__init__.py` exporting `run()` and `pkg_gamma_62/core.py` implementing `run()` returning 'pkg_gamma_62-ok'.",
  "capability": [
    "multi_file",
    "write"
  ],
  "difficulty": 3,
  "language": "python",
  "tags": [
    "generated",
    "multi_file"
  ],
  "timeout_s": 180,
  "setup": {
    "files": {
      "README.md": "# pkg_gamma_62\n"
    }
  },
  "checks": [
    {
      "function": "file_exists",
      "args": {
        "path": "pkg_gamma_62/__init__.py"
      }
    },
    {
      "function": "file_exists",
      "args": {
        "path": "pkg_gamma_62/core.py"
      }
    },
    {
      "function": "stdout_equals",
      "args": {
        "command": [
          "python",
          "-c",
          "from pkg_gamma_62 import run; print(run())"
        ],
        "expected": "pkg_gamma_62-ok"
      }
    }
  ]
}