{
  "id": "gen.cli.greet.gamma.v34",
  "title": "greet gamma",
  "prompt": "Fix `main.py` so running `python main.py gamma` prints exactly `Hello, gamma!`",
  "capability": [
    "bugfix",
    "cli"
  ],
  "difficulty": 2,
  "language": "python",
  "tags": [
    "generated",
    "cli",
    "full"
  ],
  "timeout_s": 120,
  "setup": {
    "files": {
      "main.py": "def main():\n    print(\"hello\")\n\nif __name__ == \"__main__\":\n    main()\n"
    }
  },
  "checks": [
    {
      "function": "stdout_equals",
      "args": {
        "command": [
          "python",
          "main.py",
          "gamma"
        ],
        "expected": "Hello, gamma!"
      }
    },
    {
      "function": "no_stub_content",
      "args": {
        "path": "main.py"
      }
    }
  ]
}