{
  "id": "gen.multi.pkg_delta_47.v947",
  "title": "package pkg_delta_47",
  "prompt": "Create package `pkg_delta_47` with `__init__.py` exporting `run()` and `pkg_delta_47/core.py` implementing `run()` returning 'pkg_delta_47-ok'.",
  "capability": [
    "multi_file",
    "write"
  ],
  "difficulty": 3,
  "language": "python",
  "tags": [
    "generated",
    "multi_file"
  ],
  "timeout_s": 180,
  "setup": {
    "files": {
      "README.md": "# pkg_delta_47\n"
    }
  },
  "checks": [
    {
      "function": "file_exists",
      "args": {
        "path": "pkg_delta_47/__init__.py"
      }
    },
    {
      "function": "file_exists",
      "args": {
        "path": "pkg_delta_47/core.py"
      }
    },
    {
      "function": "stdout_equals",
      "args": {
        "command": [
          "python",
          "-c",
          "from pkg_delta_47 import run; print(run())"
        ],
        "expected": "pkg_delta_47-ok"
      }
    }
  ]
}