{
  "id": "gen.multi.pkg_eta_74.v974",
  "title": "package pkg_eta_74",
  "prompt": "Create package `pkg_eta_74` with `__init__.py` exporting `run()` and `pkg_eta_74/core.py` implementing `run()` returning 'pkg_eta_74-ok'.",
  "capability": [
    "multi_file",
    "write"
  ],
  "difficulty": 3,
  "language": "python",
  "tags": [
    "generated",
    "multi_file"
  ],
  "timeout_s": 180,
  "setup": {
    "files": {
      "README.md": "# pkg_eta_74\n"
    }
  },
  "checks": [
    {
      "function": "file_exists",
      "args": {
        "path": "pkg_eta_74/__init__.py"
      }
    },
    {
      "function": "file_exists",
      "args": {
        "path": "pkg_eta_74/core.py"
      }
    },
    {
      "function": "stdout_equals",
      "args": {
        "command": [
          "python",
          "-c",
          "from pkg_eta_74 import run; print(run())"
        ],
        "expected": "pkg_eta_74-ok"
      }
    }
  ]
}