{
  "id": "gen.multi.pkg_beta_13.v713",
  "title": "package pkg_beta_13",
  "prompt": "Create package `pkg_beta_13` with `__init__.py` exporting `run()` and `pkg_beta_13/core.py` implementing `run()` returning 'pkg_beta_13-ok'.",
  "capability": [
    "multi_file",
    "write"
  ],
  "difficulty": 3,
  "language": "python",
  "tags": [
    "generated",
    "multi_file"
  ],
  "timeout_s": 180,
  "setup": {
    "files": {
      "README.md": "# pkg_beta_13\n"
    }
  },
  "checks": [
    {
      "function": "file_exists",
      "args": {
        "path": "pkg_beta_13/__init__.py"
      }
    },
    {
      "function": "file_exists",
      "args": {
        "path": "pkg_beta_13/core.py"
      }
    },
    {
      "function": "stdout_equals",
      "args": {
        "command": [
          "python",
          "-c",
          "from pkg_beta_13 import run; print(run())"
        ],
        "expected": "pkg_beta_13-ok"
      }
    }
  ]
}