{
  "id": "gen.cli.greet.delta.v643",
  "title": "greet delta",
  "prompt": "Create `main.py` CLI: `python main.py delta` prints `Hello, delta!`",
  "capability": [
    "write",
    "cli"
  ],
  "difficulty": 1,
  "language": "python",
  "tags": [
    "generated",
    "cli",
    "full"
  ],
  "timeout_s": 120,
  "setup": {
    "files": {
      "main.py": "pass\n"
    }
  },
  "checks": [
    {
      "function": "stdout_equals",
      "args": {
        "command": [
          "python",
          "main.py",
          "delta"
        ],
        "expected": "Hello, delta!"
      }
    },
    {
      "function": "no_stub_content",
      "args": {
        "path": "main.py"
      }
    }
  ]
}