{
  "id": "gen.multi.pkg_epsilon_72.v572",
  "title": "package pkg_epsilon_72",
  "prompt": "Create package `pkg_epsilon_72` with `__init__.py` exporting `run()` and `pkg_epsilon_72/core.py` implementing `run()` returning 'pkg_epsilon_72-ok'.",
  "capability": [
    "multi_file",
    "write"
  ],
  "difficulty": 3,
  "language": "python",
  "tags": [
    "generated",
    "multi_file"
  ],
  "timeout_s": 180,
  "setup": {
    "files": {
      "README.md": "# pkg_epsilon_72\n"
    }
  },
  "checks": [
    {
      "function": "file_exists",
      "args": {
        "path": "pkg_epsilon_72/__init__.py"
      }
    },
    {
      "function": "file_exists",
      "args": {
        "path": "pkg_epsilon_72/core.py"
      }
    },
    {
      "function": "stdout_equals",
      "args": {
        "command": [
          "python",
          "-c",
          "from pkg_epsilon_72 import run; print(run())"
        ],
        "expected": "pkg_epsilon_72-ok"
      }
    }
  ]
}