{
  "id": "gen.calc.sub.1.4.v969",
  "title": "calc sub (1,4)",
  "prompt": "Implement `calc(a, b)` in `calc.py` for integer sub. Make tests pass.",
  "capability": [
    "write",
    "edit"
  ],
  "difficulty": 1,
  "language": "python",
  "tags": [
    "generated",
    "calc",
    "sub",
    "full"
  ],
  "timeout_s": 120,
  "setup": {
    "files": {
      "calc.py": "def calc(a, b):\n    return a - b\n",
      "test_calc.py": "from calc import calc\n\n\ndef test_op():\n    assert calc(1, 4) == -3\n"
    }
  },
  "checks": [
    {
      "function": "compile_ok",
      "args": {
        "path": "calc.py"
      }
    },
    {
      "function": "pytest_passes",
      "args": {
        "path": "test_calc.py"
      }
    },
    {
      "function": "no_stub_content",
      "args": {}
    }
  ]
}